{"base_contract":{"path":"oc3/INPUTS/OC3_PSF_RESOURCE_CONTRACT_001.json","sha256":"1720e8ae9b77f4d5b7de9b7d28a2dbf3d1785c7005e2507e9a9ba21467dbc9f7"},"bulk_psf_acquisition_authorized":false,"command_argv":["/home/jzsalinas/Documents/galaxy-morphology-discovery/oc3/.venv/bin/python","/home/jzsalinas/Documents/galaxy-morphology-discovery/oc3/oc3_coadd_psf_contract_probe.py","--execute-probe","--execute-network","--project","/home/jzsalinas/Documents/galaxy-morphology-discovery","--binding","/home/jzsalinas/Documents/galaxy-morphology-discovery/oc3/INPUTS/OC3_COADD_PSF_CONTRACT_PROBE_BINDING_001.json","--audit-directory","/home/jzsalinas/Documents/galaxy-morphology-discovery/oc3/coadd_psf_contract_probe/OC3-COADD-PSF-CONTRACT-PROBE-001","--log","/home/jzsalinas/Documents/galaxy-morphology-discovery/oc3/coadd_psf_contract_probe/OC3-COADD-PSF-CONTRACT-PROBE-001/PROBE_RUN.log","--max-new-requests","2","--max-response-bytes","1048576","--max-total-bytes","2097152"],"cumulative_budget":{"global_body_cap":1610612736,"starting_body_bytes":93870926,"starting_requests":278},"fixed_native_contract":{"path":"oc3/fixed_native_resource_contract/OC3-FIXED-NATIVE-RESOURCE-PROBE-001/FIXED_NATIVE_RESOURCE_CONTRACT_RESOLVED.json","sha256":"8e8ac029aa61e82b2a089205aff4781123700a30ce24353dd95e5eaedd55befc","state":"FIXED_NATIVE_RESOURCE_CONTRACT_RESOLVED"},"identity_manifest":{"path":"oc3/TECHNICAL_INDEX/OC3_PSF_IDENTITIES.json","sha256":"8c8ec5a14169154fce82f6b7a6de147d08e749ba5b410974fd920411b8fe9036"},"image_invvar_acquisition_authorized":false,"implementation":{"entrypoint_path":"oc3/oc3_coadd_psf_contract_probe.py","entrypoint_sha256":"dfe07211ba5673e1861e560286cdb9c41e9fe78f3f40b0909e4fc9c216d7fbc7","module_path":"oc3/oc3lib/coadd_psf_contract.py","module_sha256":"b7f3a9ca27bababed74ae27e736715aead8170a8c290346927abb51f697d5e61"},"locations_binding":{"path":"oc3/TECHNICAL_INDEX/OC3_LOCATIONS.json","selection_sha256":"2e6f2cb070a363e9e3dbdb1f25670590c33500a293bb926d8ff94657a2ff8860","sha256":"33d593638c074a3ff59d32d3e4c38558e8912377ea15818ca5072087007c97d1"},"policy":{"band_query_parameter":null,"concurrency":1,"durable_regional_checkpoints":true,"http_method":"GET","image_invvar_access":false,"max_new_requests":2,"max_response_bytes":1048576,"max_total_body_bytes":2097152,"morphology_access":false,"pixel_value_decode":false,"primary_requests":2,"redirects":false,"retries":0},"representative_requests":[{"brick":"3443m052","expected_observational_bands":["g","r","z"],"layer":"ls-dr9-south","literal_url":"https://www.legacysurvey.org/viewer/coadd-psf/?ra=344.30863607318&dec=-5.28780763230172&layer=ls-dr9-south","max_response_bytes":1048576,"native_xy":[2112,1280],"point_id":"P0","query_bands_parameter":null,"ra_dec":[344.3086360731805,-5.287807632301723],"region":"south","slot":"S1","transport_id":"oc3psft_bd60b870a038e32de6b11237"},{"brick":"2478p325","expected_observational_bands":["g","r","z"],"layer":"ls-dr9-north","literal_url":"https://www.legacysurvey.org/viewer/coadd-psf/?ra=247.761324628593&dec=32.5506696522551&layer=ls-dr9-north","max_response_bytes":1048576,"native_xy":[2624,2496],"point_id":"P0","query_bands_parameter":null,"ra_dec":[247.76132462859286,32.550669652255074],"region":"north","slot":"N1","transport_id":"oc3psft_ea9facb3e4d9f7bf83675506"}],"schema_version":"OC3_COADD_PSF_CONTRACT_PROBE_BINDING_001","sealed":"2f0d66258846780ab8c755dc8ada8266e88bb45c3c89680bd9eb6644e79f5195","stage_id":"OC3-COADD-PSF-CONTRACT-PROBE-001"}
